{
 "formatVersion": "1.0",
 "component": "mini",
 "packVersion": "1.21",
 "analyzedSha": "WORKTREE",
 "watchPaths": [
  "src/mini.py"
 ],
 "states": [
  "idle",
  "open",
  "closed"
 ],
 "events": [
  {
   "id": "M1",
   "undesired": false
  },
  {
   "id": "M2",
   "undesired": false
  },
  {
   "id": "UV-M1-dup",
   "undesired": true
  }
 ],
 "cells": [
  {
   "disposition": "transition",
   "target": "open",
   "citation": {
    "file": "src/mini.py",
    "line": 10
   },
   "state": "idle",
   "event": "M1"
  },
  {
   "disposition": "ignore (documented)",
   "citation": {
    "file": "src/mini.py",
    "line": 20
   },
   "state": "idle",
   "event": "M2"
  },
  {
   "disposition": "handle",
   "citation": {
    "file": "src/mini.py",
    "line": 30
   },
   "state": "idle",
   "event": "UV-M1-dup"
  },
  {
   "disposition": "ignore (documented)",
   "citation": {
    "file": "src/mini.py",
    "line": 40
   },
   "state": "open",
   "event": "M1"
  },
  {
   "disposition": "transition",
   "target": "closed",
   "citation": {
    "file": "src/mini.py",
    "line": 50
   },
   "state": "open",
   "event": "M2"
  },
  {
   "disposition": "handle",
   "citation": {
    "file": "src/mini.py",
    "line": 60
   },
   "state": "open",
   "event": "UV-M1-dup"
  },
  {
   "disposition": "reject",
   "citation": {
    "file": "src/mini.py",
    "line": 70
   },
   "state": "closed",
   "event": "M1"
  },
  {
   "disposition": "ignore (documented)",
   "citation": {
    "file": "src/mini.py",
    "line": 80
   },
   "state": "closed",
   "event": "M2"
  },
  {
   "disposition": "handle",
   "citation": {
    "file": "src/mini.py",
    "line": 90
   },
   "state": "closed",
   "event": "UV-M1-dup"
  }
 ],
 "questions": [],
 "behaviouralDrs": [],
 "completeness": {
  "pairs": {
   "count": 0,
   "reason": "the sidecar generator derives cells from disposition-matrix.md only; this section is not in the matrix. Merge it from adversarial-traces.md before the component claims L4."
  },
  "guardGroups": {
   "count": 0,
   "reason": "the sidecar generator derives cells from disposition-matrix.md only; this section is not in the matrix. Merge it from guard-results.txt before the component claims L4."
  },
  "coverage": {
   "count": 0,
   "reason": "the sidecar generator derives cells from disposition-matrix.md only; this section is not in the matrix. Merge it from event-catalogue.md before the component claims L4."
  }
 }
}
