{
 "formatVersion": "1.0",
 "component": "valkey-glide-5803",
 "states": [],
 "events": [],
 "cells": [],
 "questions": [
  {
   "id": "Q-04",
   "status": "OPEN",
   "fault": [
    "F-07"
   ],
   "trigger": "step-4 matrix walk; doctrine mapping"
  },
  {
   "id": "Q-02",
   "status": "OPEN",
   "fault": [
    "F-08"
   ],
   "trigger": "step-4 matrix walk"
  },
  {
   "id": "Q-03",
   "status": "OPEN",
   "fault": [
    "F-08"
   ],
   "trigger": "step-4 matrix walk"
  }
 ]
}