{
 "formatVersion": "1.0",
 "component": "meilisearch-6508",
 "states": [],
 "events": [],
 "cells": [],
 "questions": [
  {
   "id": "Q-D1",
   "status": "OPEN",
   "fault": [
    "F-08"
   ],
   "trigger": "step-4 matrix walk"
  },
  {
   "id": "Q-D2",
   "status": "OPEN",
   "fault": [
    "F-09"
   ],
   "trigger": "step-4 matrix walk"
  },
  {
   "id": "Q-D3",
   "status": "OPEN",
   "fault": [
    "F-13"
   ],
   "trigger": "step-4 matrix walk"
  }
 ]
}