{
 "formatVersion": "1.0",
 "component": "mini",
 "packVersion": "1.21",
 "analyzedSha": "WORKTREE",
 "watchPaths": [
  "src/mini.py"
 ],
 "states": [
  "Idle",
  "Open",
  "Closed"
 ],
 "events": [
  {
   "id": "M1",
   "undesired": false,
   "gate": "payload content",
   "upstream_guards": [
    "validated upstream"
   ]
  },
  {
   "id": "M2",
   "undesired": false,
   "gate": "payload content",
   "upstream_guards": [
    "validated upstream"
   ]
  },
  {
   "id": "UV-M1-dup",
   "undesired": true
  }
 ],
 "cells": [
  {
   "disposition": "transition",
   "target": "Open",
   "citation": {
    "file": "src/mini.py",
    "line": 10
   },
   "state": "Idle",
   "event": "M1"
  },
  {
   "disposition": "ignore (documented)",
   "citation": {
    "file": "src/mini.py",
    "line": 20
   },
   "state": "Idle",
   "event": "M2"
  },
  {
   "disposition": "handle",
   "citation": {
    "file": "src/mini.py",
    "line": 30
   },
   "state": "Idle",
   "event": "UV-M1-dup"
  },
  {
   "disposition": "ignore (documented)",
   "citation": {
    "file": "src/mini.py",
    "line": 40
   },
   "state": "Open",
   "event": "M1"
  },
  {
   "disposition": "transition",
   "target": "Closed",
   "citation": {
    "file": "src/mini.py",
    "line": 50
   },
   "state": "Open",
   "event": "M2"
  },
  {
   "disposition": "handle",
   "citation": {
    "file": "src/mini.py",
    "line": 60
   },
   "state": "Open",
   "event": "UV-M1-dup"
  },
  {
   "disposition": "reject",
   "citation": {
    "file": "src/mini.py",
    "line": 70
   },
   "state": "Closed",
   "event": "M1"
  },
  {
   "disposition": "ignore (documented)",
   "citation": {
    "file": "src/mini.py",
    "line": 80
   },
   "state": "Closed",
   "event": "M2"
  },
  {
   "disposition": "handle",
   "citation": {
    "file": "src/mini.py",
    "line": 90
   },
   "state": "Closed",
   "event": "UV-M1-dup"
  }
 ],
 "questions": [],
 "behaviouralDrs": [],
 "completeness": {
  "pairs": {
   "count": 0,
   "reason": "the sidecar generator derives cells from disposition-matrix.md only; this section is not in the matrix. Merge it from adversarial-traces.md before the component claims L4."
  },
  "guardGroups": {
   "count": 0,
   "reason": "the sidecar generator derives cells from disposition-matrix.md only; this section is not in the matrix. Merge it from guard-results.txt before the component claims L4."
  }
 },
 "coverage": {
  "M1": {
   "loss": "n/a: local",
   "delay": "n/a: sync",
   "duplication": "n/a: sync",
   "out-of-order": "n/a: sync",
   "contradiction": "n/a: sync",
   "commission": "n/a: sync",
   "value": "n/a: payload validated"
  },
  "M2": {
   "loss": "n/a: local",
   "delay": "n/a: sync",
   "duplication": "n/a: sync",
   "out-of-order": "n/a: sync",
   "contradiction": "n/a: sync",
   "commission": "n/a: sync",
   "value": "n/a: payload validated"
  }
 }
}