{
 "formatVersion": "1.0",
 "component": "ensemble-test",
 "states": ["Idle", "Open", "Closed"],
 "events": [
  {"id": "E1", "undesired": false},
  {"id": "E2", "undesired": false},
  {"id": "UV-E1-dup", "undesired": true}
 ],
 "cells": [
  {"state": "Idle", "event": "E1", "disposition": "transition", "target": "Open"},
  {"state": "Idle", "event": "E2", "disposition": "ignore (documented)"},
  {"state": "Idle", "event": "UV-E1-dup", "disposition": "reject"},
  {"state": "Open", "event": "E1", "disposition": "handle"},
  {"state": "Open", "event": "E2", "disposition": "transition", "target": "Closed"},
  {"state": "Open", "event": "UV-E1-dup", "disposition": "transition", "target": "Idle"},
  {"state": "Closed", "event": "E1", "disposition": "reject"},
  {"state": "Closed", "event": "E2", "disposition": "ignore (documented)"},
  {"state": "Closed", "event": "UV-E1-dup", "disposition": "handle"}
 ],
 "questions": []
}
