{
 "formatVersion": "1.0",
 "component": "gate",
 "packVersion": "",
 "analyzedSha": "WORKTREE",
 "watchPaths": [],
 "states": [
  "Open Idle",
  "Open Busy",
  "Closed"
 ],
 "events": [
  {
   "id": "E1",
   "undesired": false,
   "gate": "payload content",
   "upstream_guards": [
    "validated upstream"
   ]
  },
  {
   "id": "E2",
   "undesired": false,
   "gate": "payload content",
   "upstream_guards": [
    "validated upstream"
   ]
  },
  {
   "id": "UV-E1",
   "undesired": true
  },
  {
   "id": "E3",
   "undesired": false,
   "gate": "payload content",
   "upstream_guards": [
    "validated upstream"
   ]
  }
 ],
 "cells": [
  {
   "disposition": "transition",
   "target": "Open Busy",
   "citation": {
    "file": "src/gate.ts",
    "line": 12
   },
   "state": "Open Idle",
   "event": "E1"
  },
  {
   "disposition": "ignore (documented)",
   "dr": "DR-001",
   "state": "Open Idle",
   "event": "E2"
  },
  {
   "disposition": "defer (queued)",
   "dr": "DR-001",
   "state": "Open Busy",
   "event": "E1"
  },
  {
   "disposition": "transition",
   "target": "Open Idle",
   "citation": {
    "file": "src/gate.ts",
    "line": 20
   },
   "state": "Open Busy",
   "event": "E2"
  },
  {
   "disposition": "reject",
   "citation": {
    "file": "src/gate.ts",
    "line": 28
   },
   "state": "Closed",
   "event": "E1"
  },
  {
   "disposition": "ignore (accidental)",
   "q": "Q-01",
   "state": "Closed",
   "event": "E2"
  },
  {
   "disposition": "UNSPECIFIED",
   "q": "Q-02",
   "state": "Open Idle",
   "event": "UV-E1"
  },
  {
   "disposition": "transition",
   "target": "Closed",
   "citation": {
    "file": "src/gate.ts",
    "line": 28
   },
   "state": "Open Idle",
   "event": "E3"
  },
  {
   "disposition": "UNSPECIFIED",
   "q": "Q-02",
   "state": "Open Busy",
   "event": "UV-E1"
  },
  {
   "disposition": "transition",
   "target": "Closed",
   "citation": {
    "file": "src/gate.ts",
    "line": 28
   },
   "state": "Open Busy",
   "event": "E3"
  },
  {
   "disposition": "ignore (documented)",
   "dr": "DR-001",
   "state": "Closed",
   "event": "UV-E1"
  },
  {
   "disposition": "ignore (documented)",
   "dr": "DR-001",
   "state": "Closed",
   "event": "E3"
  }
 ],
 "questions": [
  {
   "id": "Q-01",
   "status": "OPEN \u2014 human decision required"
  },
  {
   "id": "Q-02",
   "status": "OPEN \u2014 human decision required"
  }
 ],
 "behaviouralDrs": [
  "DR-001"
 ],
 "completeness": {
  "pairs": {
   "count": 0,
   "reason": "the sidecar generator derives cells from disposition-matrix.md only; this section is not in the matrix. Merge it from adversarial-traces.md before the component claims L4."
  },
  "guardGroups": {
   "count": 0,
   "reason": "the sidecar generator derives cells from disposition-matrix.md only; this section is not in the matrix. Merge it from guard-results.txt before the component claims L4."
  },
  "coverage": {
   "count": 0,
   "reason": "the sidecar generator derives cells from disposition-matrix.md only; this section is not in the matrix. Merge it from event-catalogue.md before the component claims L4."
  }
 }
}